Question and Choices,Answer
"Based on the question, analyze each option and select the most appropriate answer. Please provide a final answer to the question.
Which factor will most likely cause a person to develop a fever?
A. a leg muscle relaxing after exercise
B. a bacterial population in the bloodstream
C. several viral particles on the skin
D. carbohydrates being digested in the stomach",B. a bacterial population in the bloodstream
"Based on the question, analyze each option and select the most appropriate answer. Please provide a final answer to the question.
Lichens are symbiotic organisms made of green algae and fungi. What do the green algae supply to the fungi in this symbiotic relationship?
A. carbon dioxide
B. food
C. protection
D. water",B. food
"Based on the question, analyze each option and select the most appropriate answer. Please provide a final answer to the question.
When a switch is used in an electrical circuit, the switch can
A. cause the charge to build.
B. increase and decrease the voltage.
C. cause the current to change direction.
D. stop and start the flow of current.",D. stop and start the flow of current.
"Based on the question, analyze each option and select the most appropriate answer. Please provide a final answer to the question.
Which of the following is an example of an assistive device?
A. contact lens
B. motorcycle
C. raincoat
D. coffee pot",A. contact lens
"Based on the question, analyze each option and select the most appropriate answer. Please provide a final answer to the question.
Rocks are classified as igneous, metamorphic, or sedimentary according to
1. their color
2. their shape
3. how they formed
4. the minerals they contain",3. how they formed
"Based on the question, analyze each option and select the most appropriate answer. Please provide a final answer to the question.
A chewable calcium carbonate tablet is a common treatment for stomach discomfort. Calcium carbonate is most likely used as this type of medicine because calcium carbonate
A. has a pleasant flavor.
B. is inexpensive to produce.
C. neutralizes digestive acid.
D. occurs naturally in the body.",C. neutralizes digestive acid.
"Based on the question, analyze each option and select the most appropriate answer. Please provide a final answer to the question.
Which two body systems are directly involved in movement?
A. muscular and skeletal
B. digestive and muscular
C. skeletal and respiratory
D. respiratory and digestive",A. muscular and skeletal
"Based on the question, analyze each option and select the most appropriate answer. Please provide a final answer to the question.
Which change in the state of water particles causes the particles to become arranged in a fixed position?
A. boiling
B. melting
C. freezing
D. evaporating",C. freezing
"Based on the question, analyze each option and select the most appropriate answer. Please provide a final answer to the question.
Earth's core is primarily composed of which of the following materials?
A. basalt
B. iron
C. magma
D. quartz",B. iron
"Based on the question, analyze each option and select the most appropriate answer. Please provide a final answer to the question.
Which of the following events during meiosis contributes most to the variation within a species?
A. pairing of chromosomes
B. creation of haploid gametes
C. segregation of alleles
D. separation of chromatids",C. segregation of alleles
"Based on the question, analyze each option and select the most appropriate answer. Please provide a final answer to the question.
Which of the following was probably most important in the formation of dark, fertile soil that is good for farming?
A. plant decomposition
B. radioactive decay
C. water erosion
D. wind erosion",A. plant decomposition
"Based on the question, analyze each option and select the most appropriate answer. Please provide a final answer to the question.
When igneous rock is changed into metamorphic rock, which form of energy is this process?
A. heat
B. chemical
C. magnetic
D. light",A. heat
"Based on the question, analyze each option and select the most appropriate answer. Please provide a final answer to the question.
In humans, the digestion process begins in
A. the intestine, with squeezing.
B. the mouth, with chewing and saliva.
C. the stomach, with churning and acid.
D. the esophagus, with pushing towards the stomach.","B. the mouth, with chewing and saliva."
"Based on the question, analyze each option and select the most appropriate answer. Please provide a final answer to the question.
Which of these items contains only a solution?
A. a jar of pickles
B. a bottle of juice
C. a bag of peanuts
D. a can of mixed fruit",B. a bottle of juice
"Based on the question, analyze each option and select the most appropriate answer. Please provide a final answer to the question.
Many natural rock formations change color over time. In Utah, for example, iron oxidized and formed red, orange, and yellow rock. Which of the following is the cause of this change?
A. chemical weathering
B. mechanical weathering
C. water erosion
D. wind erosion",A. chemical weathering
"Based on the question, analyze each option and select the most appropriate answer. Please provide a final answer to the question.
A population of small, plant-eating beetles lives in a forest. About half of the beetles are light brown and the others are dark green. If years of drought cause the area to become dry with few trees, what would the beetle population most likely look like after several generations?
A. It would be mostly light brown beetles.
B. It would be mostly dark green beetles.
C. It would be mostly carnivorous beetles.
D. It would be mostly very large beetles.",A. It would be mostly light brown beetles.
"Based on the question, analyze each option and select the most appropriate answer. Please provide a final answer to the question.
A scientist wanting to document a change in a river's flow pattern should observe a river over a period of
A. days.
B. weeks.
C. months.
D. years.",D. years.
"Based on the question, analyze each option and select the most appropriate answer. Please provide a final answer to the question.
Automobile engines built today are designed to be gas efficient. Gas-efficient engines most likely affect a city by reducing
A. air pollution.
B. heat pollution.
C. noise pollution.
D. light pollution.",A. air pollution.
"Based on the question, analyze each option and select the most appropriate answer. Please provide a final answer to the question.
A student in an empty classroom shouts, ""Hello!"" Which best explains what the student hears after the shout?
A. an increased loudness of sound
B. a reflection of sound
C. an increased frequency of sound
D. a refraction of sound",B. a reflection of sound
"Based on the question, analyze each option and select the most appropriate answer. Please provide a final answer to the question.
Which type of energy in gasoline is transformed into mechanical energy in a motorcycle engine?
1. chemical
2. nuclear
3. magnetic
4. electrical",1. chemical
"Based on the question, analyze each option and select the most appropriate answer. Please provide a final answer to the question.
A student standing near a campfire feels warmer as the fire grows. Which process most likely transfers heat from the campfire to the student?
A. conduction
B. convection
C. radiation
D. transformation",C. radiation
"Based on the question, analyze each option and select the most appropriate answer. Please provide a final answer to the question.
In snapdragon plants, red flowers are dominant to white flowers. When red-flowered plants are crossed with white-flowered plants, pink flowers are produced. If a researcher wants to produce plants with only white flowers, what color should the parent plants be?
A. both red
B. both white
C. one red and one white
D. one white and one pink",B. both white
"Based on the question, analyze each option and select the most appropriate answer. Please provide a final answer to the question.
Scientists use the term ""light year"" to describe
A. how fast light travels in space.
B. the distance light travels in one year.
C. how large the diameters of different stars are.
D. the time it takes the Sun to move through the galaxy.",B. the distance light travels in one year.
"Based on the question, analyze each option and select the most appropriate answer. Please provide a final answer to the question.
Plate movement can form different features on Earth. The movement of tectonic plates can be both a constructive and a destructive force. At which type of plate boundary is new crust formed?
A. convergent
B. subduction
C. transform
D. divergent",D. divergent
"Based on the question, analyze each option and select the most appropriate answer. Please provide a final answer to the question.
Which group of organisms can show significant trait changes in the shortest period of time?
1. bacteria
2. birds
3. fish
4. reptiles",1. bacteria
"Based on the question, analyze each option and select the most appropriate answer. Please provide a final answer to the question.
Peach trees have sweet-smelling blossoms and produce rich fruit. What is the main purpose of the flowers of a peach tree?
A. to attract bees for pollination
B. to create flower arrangements
C. to protect the tree from disease
D. to feed migratory birds",A. to attract bees for pollination
"Based on the question, analyze each option and select the most appropriate answer. Please provide a final answer to the question.
A group of students are researching changes in climate in their region. Which of these would best provide evidence of changes in temperature and rainfall over a period of years?
A. tree rings
B. pollen samples
C. harvest production
D. carbon dating",A. tree rings
"Based on the question, analyze each option and select the most appropriate answer. Please provide a final answer to the question.
Which of these would help to prevent infections from occurring in small cuts and scrapes?
A. apply a cold ice pack
B. raise the injured area
C. apply pressure to stop bleeding
D. wash the area with warm, soapy water","D. wash the area with warm, soapy water"
"Based on the question, analyze each option and select the most appropriate answer. Please provide a final answer to the question.
Which best describes why winds at the beach change direction between day and night?
A. because the temperatures over land and over water change
B. because warm air over land sinks and stays in place over land
C. because cool air rises and is replaced by warm air from the ocean
D. because cool air sinks and stays in place over land",A. because the temperatures over land and over water change
"Based on the question, analyze each option and select the most appropriate answer. Please provide a final answer to the question.
Soil erosion can be best prevented by
A. removing grass from the steepest slope.
B. building terraces into the sides of a slope.
C. heavily watering the vegetation on the slope.
D. increasing the slope of the land by adding more soil.",B. building terraces into the sides of a slope.
"Based on the question, analyze each option and select the most appropriate answer. Please provide a final answer to the question.
Which of the following properties provides the BEST way to identify a mineral?
A. hardness
B. shape
C. size
D. temperature",A. hardness
"Based on the question, analyze each option and select the most appropriate answer. Please provide a final answer to the question.
Which sequence represents the order of development for many plants?
1. seed develops inside fruit -> seed is dispersed -> seed germinates -> plant grows
2. seed is dispersed -> seed develops inside fruit -> seed germinates -> plant grows
3. seed germinates -> plant grows -> seed is dispersed -> seed develops inside fruit
4. seed is dispersed -> plant grows -> seed germinates -> seed develops inside fruit",1. seed develops inside fruit -> seed is dispersed -> seed germinates -> plant grows
"Based on the question, analyze each option and select the most appropriate answer. Please provide a final answer to the question.
When ice cream is left out of a freezer, the ice cream changes from a ___.
A. solid to a gas
B. gas to a liquid
C. solid to a liquid
D. liquid to a gas",C. solid to a liquid
"Based on the question, analyze each option and select the most appropriate answer. Please provide a final answer to the question.
Which equipment will best separate a mixture of iron filings and black pepper?
1. magnet
2. filter paper
3. triple-beam balance
4. voltmeter",1. magnet
"Based on the question, analyze each option and select the most appropriate answer. Please provide a final answer to the question.
Which characteristic is shared by all cells?
A. They need energy.
B. They reproduce sexually.
C. They make their own food.
D. They move from place to place.",A. They need energy.
"Based on the question, analyze each option and select the most appropriate answer. Please provide a final answer to the question.
On a small, isolated island, a hurricane destroyed all the trees that produced a large, hard-shelled nut. Which bird population would most likely decrease?
A. birds with long, probing beaks
B. birds with thick, strong beaks
C. birds with thin, short beaks
D. birds with large, pouch beaks","B. birds with thick, strong beaks"
"Based on the question, analyze each option and select the most appropriate answer. Please provide a final answer to the question.
A cow and a frog have similar bone structures in their forelimbs. Both have phalanges, radius, ulna, and humerus bones. However, the cow and frog are animals with very different life cycles from each other. Which most likely describes why the body structures of these animals are so similar?
A. Both have undergone similar mutations.
B. Both descended from a common ancestor.
C. Both reacted similarly to environmental pressures.
D. Both spread out from the same geographical region.",B. Both descended from a common ancestor.
"Based on the question, analyze each option and select the most appropriate answer. Please provide a final answer to the question.
A cell that is unable to import substances required to process chemical energy is most likely a result of a malfunctioning
A. cell membrane.
B. endoplasmic reticulum.
C. Golgi body.
D. nuclear envelope.",A. cell membrane.
"Based on the question, analyze each option and select the most appropriate answer. Please provide a final answer to the question.
Which best describes all unicellular organisms?
A. Every cell is round.
B. Every cell can make food.
C. Every cell can move on its own.
D. Every cell performs all life functions.",D. Every cell performs all life functions.
"Based on the question, analyze each option and select the most appropriate answer. Please provide a final answer to the question.
When a transverse wave passes from right to left through a medium, what happens to the particles of the medium?
A. Particles travel from right to left along the wave.
B. Particles travel from left to right along the wave.
C. Particles move back and forth parallel to the wave.
D. Particles move back and forth perpendicular to the wave.",D. Particles move back and forth perpendicular to the wave.
"Based on the question, analyze each option and select the most appropriate answer. Please provide a final answer to the question.
Which characteristic below most likely accounts for our limited knowledge of galaxies?
A. their tiny size
B. their magnetic cores
C. their inability to produce light
D. their great distance from Earth",D. their great distance from Earth
"Based on the question, analyze each option and select the most appropriate answer. Please provide a final answer to the question.
Decomposers increase the fertility of the soil and prevent dead organisms from building up in the environment. In which way do decomposers make the soil more fertile?
A. by adding carbon
B. by adding nitrogen
C. by removing excess water
D. by removing excess minerals",B. by adding nitrogen
"Based on the question, analyze each option and select the most appropriate answer. Please provide a final answer to the question.
When oxygen combines with hydrogen, which substance is formed?
A. water
B. vinegar
C. hydrochloric acid
D. hydrogen dioxide",A. water
"Based on the question, analyze each option and select the most appropriate answer. Please provide a final answer to the question.
When plants undergo photosynthesis, a reaction produces sugar, oxygen, and water. During respiration, stored energy from the products of photosynthesis is converted to usable energy. In what form is the energy stored prior to use in respiration?
A. chemical energy
B. kinetic energy
C. light energy
D. heat energy",A. chemical energy
"Based on the question, analyze each option and select the most appropriate answer. Please provide a final answer to the question.
Which of the following is a typical example of a unicellular organism?
A. earthworm
B. bacteria
C. fungi
D. green algae",B. bacteria
"Based on the question, analyze each option and select the most appropriate answer. Please provide a final answer to the question.
Over geologic time, global mean sea level has varied significantly. Which change is most likely responsible for an increase in global mean sea level?
A. erosion of sediment from a mountain range
B. mass extinction of marine organisms
C. formation of an ocean trench
D. melting of polar ice caps",D. melting of polar ice caps
"Based on the question, analyze each option and select the most appropriate answer. Please provide a final answer to the question.
Which body system is most responsible for the removal of waste?
A. skeletal system
B. nervous system
C. muscular system
D. excretory system",D. excretory system
"Based on the question, analyze each option and select the most appropriate answer. Please provide a final answer to the question.
In which environment is white fur color an advantage for survival?
A. desert
B. grassland
C. arctic tundra
D. temperate forest",C. arctic tundra
"Based on the question, analyze each option and select the most appropriate answer. Please provide a final answer to the question.
Which of these will best separate iron filings from sand?
A. water
B. a magnifying glass
C. a magnet
D. rubbing alcohol",C. a magnet
"Based on the question, analyze each option and select the most appropriate answer. Please provide a final answer to the question.
Which of these is the chemical symbol for magnesium?
A. Ma
B. Mg
C. Mn
D. Mu",B. Mg
"Based on the question, analyze each option and select the most appropriate answer. Please provide a final answer to the question.
Which of the following is most likely to lead to error in an experiment?
A. bias
B. repeated trials
C. peer review
D. use of a control",A. bias
"Based on the question, analyze each option and select the most appropriate answer. Please provide a final answer to the question.
Which best describes transportation technology?
A. a system that is used to move people and products
B. an enterprise that changes raw materials into goods
C. the building and finishing of structures
D. the conversion of mechanical energy into heat energy",A. a system that is used to move people and products
"Based on the question, analyze each option and select the most appropriate answer. Please provide a final answer to the question.
In a gasoline-powered car, chemical energy from gasoline is transformed to make the car move. The motion of the car is what form of energy?
A. radiant energy
B. nuclear energy
C. electrical energy
D. mechanical energy",D. mechanical energy
"Based on the question, analyze each option and select the most appropriate answer. Please provide a final answer to the question.
Which characteristic is affected by interactions with the environment?
A. weight
B. eye color
C. blood type
D. handedness",A. weight
"Based on the question, analyze each option and select the most appropriate answer. Please provide a final answer to the question.
Which is the greatest impact humans have had on the carbon cycle?
A. clear-cutting forests
B. manufacturing plastics
C. burning fossil fuels
D. growing agricultural crops",C. burning fossil fuels
"Based on the question, analyze each option and select the most appropriate answer. Please provide a final answer to the question.
The floating arrow on a compass always points towards the
A. west.
B. east.
C. south.
D. north.",D. north.
"Based on the question, analyze each option and select the most appropriate answer. Please provide a final answer to the question.
Which color shirt will reflect the most light on a hot, sunny day?
A. black
B. blue
C. red
D. white",D. white
"Based on the question, analyze each option and select the most appropriate answer. Please provide a final answer to the question.
A 10 g sample of aluminum and a 10 g sample of iron were each heated by 100 joules of energy. The temperature of the aluminum sample rose 11°C, while the temperature of the iron sample increased 23°C. Which statement best accounts for these results?
A. Iron is twice as dense as aluminum.
B. Atoms of aluminum are smaller than atoms of iron.
C. Using equal masses results in similar heat capacities.
D. The specific heat of iron is less than that of aluminum.",D. The specific heat of iron is less than that of aluminum.
"Based on the question, analyze each option and select the most appropriate answer. Please provide a final answer to the question.
If its food supply in a field decreases, the mouse population in that field will probably
A. increase.
B. decrease.
C. remain the same.
D. become extinct.",B. decrease.
"Based on the question, analyze each option and select the most appropriate answer. Please provide a final answer to the question.
Overuse of soil for farming causes local disruptions of several Earth subsystems. Which of these is a part of the biogeochemical cycle that experiences the most severe local disruption?
A. release of carbon into the atmosphere
B. release of oxygen into the atmosphere
C. cycling phosphorus into the soil
D. cycling hydrogen into the soil",C. cycling phosphorus into the soil
"Based on the question, analyze each option and select the most appropriate answer. Please provide a final answer to the question.
Which of the following is an example of a physical change but not a chemical change?
A. A log gives off heat and light as it burns.
B. A tree stores energy from the Sun in its fruit.
C. A penny lost in the grass slowly changes color.
D. A water pipe freezes and cracks on a cold night.",D. A water pipe freezes and cracks on a cold night.
"Based on the question, analyze each option and select the most appropriate answer. Please provide a final answer to the question.
While conducting an investigation on refraction, a teacher uses a red laser pointer to show how a beam of light is affected as it passes through several glass objects. The teacher should make sure that the
A. room is totally dark.
B. light source is ultraviolet.
C. beam of light does not travel toward the students.
D. room walls are shielded with insulating material.",C. beam of light does not travel toward the students.
"Based on the question, analyze each option and select the most appropriate answer. Please provide a final answer to the question.
One student wrote a report about an investigation in which fertilizer was added to tomato plants. Which information from that student's report would most help a second student repeat the investigation?
A. the amount of fertilizer added
B. the height of the fertilized plants
C. the size of each tomato produced
D. the number of tomatoes produced",A. the amount of fertilizer added
"Based on the question, analyze each option and select the most appropriate answer. Please provide a final answer to the question.
A student wants to look under a heavy rock. Which simple machine would be BEST to use to lift the rock?
A. Wheel and axle
B. Lever
C. Inclined plane
D. Screw",B. Lever
"Based on the question, analyze each option and select the most appropriate answer. Please provide a final answer to the question.
Rust is a compound with the formula Fe_{2}O_{3}. Which elements combine to form rust?
A. iron and water
B. iron and oxygen
C. iron and air
D. iron and acid",B. iron and oxygen
"Based on the question, analyze each option and select the most appropriate answer. Please provide a final answer to the question.
The chemical equation below shows a reaction of copper (Cu) with silver nitrate (AgNO_{3}) yielding silver (Ag) and copper(II) nitrate (Cu(NO_{3})_{2}) Cu + 2AgNO_{3} -> 2Ag + Cu(NO_{3})_{2} Silver and copper(II) nitrate are called the
A. reactants.
B. products.
C. catalysts.
D. inhibitors.",B. products.
"Based on the question, analyze each option and select the most appropriate answer. Please provide a final answer to the question.
What role does the centromere play in cellular reproduction?
A. It is the area where microtubules are formed.
B. It is the area where the nucleus is during cell division.
C. It is the area of alignment for the chromosomes.
D. It is the area of attachment for chromatids.",D. It is the area of attachment for chromatids.
"Based on the question, analyze each option and select the most appropriate answer. Please provide a final answer to the question.
If 1 kg of the compound toluene melts at -95°C, then 500 g of toluene will
A. melt at -47.5°C.
B. melt at -95°C.
C. boil at 95°C.
D. boil at 47.5°C.",B. melt at -95°C.
