Question and Choices,Answer
"Based on the question, analyze each option and select the most appropriate answer. Please provide a final answer to the question.
When carbon and oxygen combine chemically, the mass of the product is
1. greater than the mass of the carbon plus the mass of the oxygen
2. equal to the mass of the carbon plus the mass of the oxygen
3. equal to the mass of the carbon
4. less than the mass of the carbon",2. equal to the mass of the carbon plus the mass of the oxygen
"Based on the question, analyze each option and select the most appropriate answer. Please provide a final answer to the question.
Juvenile diabetes is a disease caused by the body's inability to create insulin. The body's white blood cells attack the pancreatic cells that produce insulin. This type of disease is known as
A. a cardiovascular disease.
B. an infectious disease.
C. a digestive system disease.
D. an autoimmune disease.",D. an autoimmune disease.
"Based on the question, analyze each option and select the most appropriate answer. Please provide a final answer to the question.
Which of these describes a property of all matter?
A. All matter gives off light.
B. All matter is attracted by magnets.
C. All matter is made of atoms.
D. All matter dissolves in water.",C. All matter is made of atoms.
"Based on the question, analyze each option and select the most appropriate answer. Please provide a final answer to the question.
Which of the following is a characteristic of all chemical changes?
A. A different state of matter is produced.
B. Some mass is converted to energy.
C. Some form of light is given off.
D. A new material is formed.",D. A new material is formed.
"Based on the question, analyze each option and select the most appropriate answer. Please provide a final answer to the question.
What is the complementary base of adenine in DNA?
A. cytosine
B. thymine
C. guanine
D. uracil",B. thymine
"Based on the question, analyze each option and select the most appropriate answer. Please provide a final answer to the question.
What is the density of a 64-g iron cube that displaces 8 mL of water?
A. 512 g/mL
B. 32 g/mL
C. 8 g/mL
D. 4 g/mL",C. 8 g/mL
"Based on the question, analyze each option and select the most appropriate answer. Please provide a final answer to the question.
What keeps Mars in orbit around the Sun?
A. friction
B. gravity
C. magnetism
D. solar power",B. gravity
"Based on the question, analyze each option and select the most appropriate answer. Please provide a final answer to the question.
Which material is primarily a mixture of weathered rock and organic matter?
1. minerals
2. soil
3. ocean water
4. seashells",2. soil
"Based on the question, analyze each option and select the most appropriate answer. Please provide a final answer to the question.
How do plants most commonly break large rocks into smaller pieces?
A. Plant leaves insulate surrounding rocks from extreme temperatures.
B. Plant roots grow into cracks in rocks.
C. Seeds from plants fall onto rocks and release acidic compounds.
D. Stems of plants surround and squeeze rocks.",B. Plant roots grow into cracks in rocks.
"Based on the question, analyze each option and select the most appropriate answer. Please provide a final answer to the question.
Which statement best describes the climate of Nevada?
A. Temperature at night dropped behind a cold front.
B. Wind increased during the day.
C. Humidity is low throughout every summer.
D. Air pressure increased gradually all week.",C. Humidity is low throughout every summer.
"Based on the question, analyze each option and select the most appropriate answer. Please provide a final answer to the question.
What is the primary function of skin cells?
A. to deliver messages to the brain
B. to generate movement of muscles
C. to provide a physical barrier to the body
D. to produce carbohydrates for energy",C. to provide a physical barrier to the body
"Based on the question, analyze each option and select the most appropriate answer. Please provide a final answer to the question.
Some plants grow only in specific places in the world. Some cacti, for example, grow only in deserts. Which of the following is most important in determining where a plant can grow and survive?
A. animals
B. climate
C. tides
D. wind",B. climate
"Based on the question, analyze each option and select the most appropriate answer. Please provide a final answer to the question.
A geologist found fossils of horse bones in different rock layers of a canyon. The fossils in the lower levels show shorter bones than those in the upper-level fossils. Which conclusion is based on the geologist's observations?
A. Horse's reproduce using two parents.
B. Horse's became larger over time.
C. Smaller Horse's went extinct, and then larger Horse's formed.
D. Smaller Horse's are better suited to the environment than larger Horse's.",B. Horse's became larger over time.
"Based on the question, analyze each option and select the most appropriate answer. Please provide a final answer to the question.
Which of the following is a reason life in the outermost planets is less likely than life on planets nearer the Sun?
A. They have too little mass.
B. They have too much mass.
C. Their surfaces are extremely hot.
D. Their surfaces are extremely cold.",D. Their surfaces are extremely cold.
"Based on the question, analyze each option and select the most appropriate answer. Please provide a final answer to the question.
Which statement best explains how periods on the periodic table are organized?
A. increasing atomic number from left to right
B. increasing number of neutrons from left to right
C. decreasing number of electrons from left to right
D. decreasing atomic mass number from left to right",A. increasing atomic number from left to right
"Based on the question, analyze each option and select the most appropriate answer. Please provide a final answer to the question.
Nonrenewable sources of energy have limited supplies. Researchers are developing devices that will make renewable energy more available. Which is a source of renewable energy?
A. coal
B. gasoline
C. oil
D. wind",D. wind
"Based on the question, analyze each option and select the most appropriate answer. Please provide a final answer to the question.
Which of these living things in a grassland ecosystem depend on the presence of a variety of bacteria and other microorganisms in the soil?
A. worms only
B. green plants only
C. plants and animals only
D. all the organisms in the ecosystem",D. all the organisms in the ecosystem
"Based on the question, analyze each option and select the most appropriate answer. Please provide a final answer to the question.
An ecosystem is a community of organisms interacting with their physical environment. Why are decomposers an important part of ecosystems?
A. They break down dead organisms to return nutrients to the soil.
B. They produce their own food for survival.
C. They play a role in preventing weathering and erosion.
D. They provide most of the energy to consumers.",A. They break down dead organisms to return nutrients to the soil.
"Based on the question, analyze each option and select the most appropriate answer. Please provide a final answer to the question.
Which term identifies a group of cells that work together to perform a similar function?
1. molecule
2. organ
3. organism
4. tissue",4. tissue
"Based on the question, analyze each option and select the most appropriate answer. Please provide a final answer to the question.
Which of these statements is not considered part of the Big Bang Theory?
A. The universe is expanding.
B. The universe never changes.
C. The universe began in a hot, dense state.
D. The universe began at a single point and time.",B. The universe never changes.
"Based on the question, analyze each option and select the most appropriate answer. Please provide a final answer to the question.
Cells in the body use oxygen (O2) for cellular respiration. Which is the result of cellular respiration?
A. ATP is produced and carbon dioxide (CO2) is released.
B. ATP is consumed and carbon dioxide (CO2) is released.
C. ATP is produced and carbon dioxide (CO2) is absorbed.
D. ATP is consumed and carbon dioxide (CO2) is absorbed.",A. ATP is produced and carbon dioxide (CO2) is released.
"Based on the question, analyze each option and select the most appropriate answer. Please provide a final answer to the question.
Which geologic process is absent from the Gulf Coast states?
A. beach development
B. subduction zones
C. weathering
D. erosion",B. subduction zones
"Based on the question, analyze each option and select the most appropriate answer. Please provide a final answer to the question.
The human body gets the energy it needs for growth and repair directly from
A. soil
B. food
C. sunlight
D. water",B. food
"Based on the question, analyze each option and select the most appropriate answer. Please provide a final answer to the question.
In what type of rock would a geologist most likely find evidence of ancient life?
A. sedimentary
B. foliated
C. metamorphic
D. volcanic",A. sedimentary
"Based on the question, analyze each option and select the most appropriate answer. Please provide a final answer to the question.
During the Apollo 14 moon landing, astronauts played golf on the moon. Which of the following would be less on the moon than on Earth?
A. The mass of the golf ball
B. The weight of the golf ball
C. The mass and size of the golf ball
D. The weight and size of the golf ball",B. The weight of the golf ball
"Based on the question, analyze each option and select the most appropriate answer. Please provide a final answer to the question.
Evaporation, condensation, and precipitation are all processes which occur in the
A. water cycle.
B. energy cycle.
C. carbon cycle.
D. nitrogen cycle.",A. water cycle.
"Based on the question, analyze each option and select the most appropriate answer. Please provide a final answer to the question.
Directions Read the information about wind erosion then answer the question. Wind can cause erosion that changes the surface of the Earth. Wind erosion can have negative effects on the environment by removing soil and polluting the air during dust storms. Walter wanted to find out if faster wind speeds increased the amount of wind erosion. Which instrument should he use to measure wind speed?
A. anemometer
B. barometer
C. rain gauge
D. thermometer",A. anemometer
"Based on the question, analyze each option and select the most appropriate answer. Please provide a final answer to the question.
Where does oxygen-rich blood go after leaving the lungs?
A. the brain.
B. the heart.
C. the kidney.
D. the stomach.",B. the heart.
"Based on the question, analyze each option and select the most appropriate answer. Please provide a final answer to the question.
Chemical pesticides are sometimes sprayed on crops to kill insects that eat the crops. People have different viewpoints about the use of pesticides on crops. What might be a concern about using pesticides on the crops?
A. Will the food ripen?
B. Will the food stay fresh?
C. Will the food harm humans?
D. Will the food harm bugs in the home?",C. Will the food harm humans?
"Based on the question, analyze each option and select the most appropriate answer. Please provide a final answer to the question.
The number of fish in a lake suddenly increases. How will the increase most likely affect the lake?
A. There will be less water in the lake.
B. More plants will grow in the lake.
C. More frogs will live in the lake.
D. There will be fewer insects in the lake.",D. There will be fewer insects in the lake.
"Based on the question, analyze each option and select the most appropriate answer. Please provide a final answer to the question.
Which statement correctly describes a relationship between two human body systems?
A. The digestive system absorbs nutrients which are transported by the nervous system.
B. The digestive system absorbs nutrients which are transported by the circulatory system.
C. The circulatory system exchanges gases which are transported by the nervous system.
D. The circulatory system exchanges gases which are transported by the digestive system.",B. The digestive system absorbs nutrients which are transported by the circulatory system.
"Based on the question, analyze each option and select the most appropriate answer. Please provide a final answer to the question.
Which statement best explains Earth's day and night cycle?
A. Earth rotates once each day on its axis.
B. Earth revolves around the Sun each year.
C. The Sun is closest to Earth during the day.
D. The tilt of Earth changes throughout the year.",A. Earth rotates once each day on its axis.
"Based on the question, analyze each option and select the most appropriate answer. Please provide a final answer to the question.
What is the first thing a student should do if an accident happens during a science experiment?
A. report to the teacher
B. clean the laboratory station
C. locate the nearest exit
D. put on safety goggles",A. report to the teacher
"Based on the question, analyze each option and select the most appropriate answer. Please provide a final answer to the question.
Which of the following helps keep the Moon in its orbit?
A. friction
B. gravity
C. longitude
D. latitude",B. gravity
"Based on the question, analyze each option and select the most appropriate answer. Please provide a final answer to the question.
Which process allows green plants to control the amount of water stored in their leaves?
A. photosynthesis
B. condensation
C. respiration
D. transpiration",D. transpiration
"Based on the question, analyze each option and select the most appropriate answer. Please provide a final answer to the question.
What is a job of white blood cells?
A. transport oxygen
B. remove waste
C. fight disease
D. enable reproduction",C. fight disease
"Based on the question, analyze each option and select the most appropriate answer. Please provide a final answer to the question.
Which is an example of kinetic energy?
A. a book sitting on a shelf
B. a ball rolling down a hill
C. a runner about to start a race
D. a window getting hot from the sun",B. a ball rolling down a hill
"Based on the question, analyze each option and select the most appropriate answer. Please provide a final answer to the question.
A new mutation that occurs in which type of cell can be passed on to offspring?
A. blood cell
B. nerve cell
C. brain cell
D. egg cell",D. egg cell
"Based on the question, analyze each option and select the most appropriate answer. Please provide a final answer to the question.
When too much salt is detected in the bloodstream, the brain secretes a hormone that helps the body retain water by reducing the amount of urine produced. This is an example of
A. a feedback loop.
B. an acquired trait.
C. a balanced ecosystem.
D. a symbiotic relationship.",A. a feedback loop.
"Based on the question, analyze each option and select the most appropriate answer. Please provide a final answer to the question.
Which of these is a safe practice in a laboratory investigation when working with chemicals?
A. pouring unused chemicals down the sink
B. mixing leftover chemicals in one container
C. wearing safety goggles when working with chemicals
D. returning unused chemicals to the original container",C. wearing safety goggles when working with chemicals
"Based on the question, analyze each option and select the most appropriate answer. Please provide a final answer to the question.
Which change in the environment would have a negative effect on the survival of a species in an ecosystem?
A. increase in the population of prey
B. introduction of a competing species
C. decrease in the population of predators
D. increase in genetic diversity of the species",B. introduction of a competing species
"Based on the question, analyze each option and select the most appropriate answer. Please provide a final answer to the question.
An element is identified by
A. its number of protons.
B. the atomic mass.
C. the type of charge.
D. its number of isotopes.",A. its number of protons.
"Based on the question, analyze each option and select the most appropriate answer. Please provide a final answer to the question.
Which of these dissolve in water?
A. Sand grains
B. Sugar cubes
C. Plastic straws
D. Wooden spoons",B. Sugar cubes
"Based on the question, analyze each option and select the most appropriate answer. Please provide a final answer to the question.
What is the main function of a plant stem?
A. to collect pollen from other plants to make seeds
B. to absorb water and plant nutrients from the soil
C. to carry food and water to the rest of the plant
D. to make food for the plant",C. to carry food and water to the rest of the plant
"Based on the question, analyze each option and select the most appropriate answer. Please provide a final answer to the question.
Naturally occurring variations within a species are mainly the result of mutations and
1. sexual reproduction
2. dynamic equilibrium
3. metabolism
4. camouflage",1. sexual reproduction
"Based on the question, analyze each option and select the most appropriate answer. Please provide a final answer to the question.
As a sample of water turns to ice,
A. new molecules are formed.
B. the mass of the sample is increased.
C. the arrangement of the molecules changes.
D. energy is absorbed by the molecules.",C. the arrangement of the molecules changes.
"Based on the question, analyze each option and select the most appropriate answer. Please provide a final answer to the question.
An ice cube is placed in a pan. The pan is placed over an open flame. Which change will most likely happen over time?
A. The ice changes to a liquid and back to a solid.
B. The ice changes to a liquid then to a gas.
C. The ice changes to a gas and back to a solid.
D. The ice changes to a gas then to a liquid.",B. The ice changes to a liquid then to a gas.
"Based on the question, analyze each option and select the most appropriate answer. Please provide a final answer to the question.
Byron is investigating how temperature affects mold growth on bread. Before starting his procedure, Byron states in his journal that he thinks wet bread placed in the refrigerator will grow the most mold. Which term best describes Byron's statement?
A. conclusion
B. result
C. hypothesis
D. variable",C. hypothesis
"Based on the question, analyze each option and select the most appropriate answer. Please provide a final answer to the question.
The telephone was invented in Boston by
A. Alexander Graham Bell.
B. Samuel F. B. Morse.
C. Henry Ford.
D. Thomas Alva Edison.",A. Alexander Graham Bell.
"Based on the question, analyze each option and select the most appropriate answer. Please provide a final answer to the question.
Which characteristic can an amoeba change that a paramecium cannot change?
A. sex
B. shape
C. color
D. position",B. shape
"Based on the question, analyze each option and select the most appropriate answer. Please provide a final answer to the question.
A metal spoon was left in a pot of boiling soup. The cook burned a finger by touching the spoon. Why did the finger get burned?
A. The metal spoon chemically reacted with the cook's hand.
B. The metal spoon conducted electricity to the cook's hand.
C. The metal spoon conducted heat to the cook's hand.
D. The metal spoon insulated the cook's hand.",C. The metal spoon conducted heat to the cook's hand.
"Based on the question, analyze each option and select the most appropriate answer. Please provide a final answer to the question.
Light rays are focused by the lens of a camera through the process of
A. reflection.
B. refraction.
C. dispersion.
D. diffraction.",B. refraction.
"Based on the question, analyze each option and select the most appropriate answer. Please provide a final answer to the question.
Which of these provides the best evidence that the distribution of Earth's oceans has changed over time?
A. hot spots on ocean floors
B. seismic activity along plate boundaries
C. sediment buildup on continental slope
D. marine fossils found on land masses",D. marine fossils found on land masses
"Based on the question, analyze each option and select the most appropriate answer. Please provide a final answer to the question.
Which change would have the greatest negative impact on the survival of an owl species?
A. an increase in primary consumer population
B. an decrease in acid rain
C. an decrease in size of habitat
D. an increase in producers",C. an decrease in size of habitat
"Based on the question, analyze each option and select the most appropriate answer. Please provide a final answer to the question.
Which organ removes cell waste from the blood?
A. the large intestine
B. the small intestine
C. the kidney
D. the heart",C. the kidney
"Based on the question, analyze each option and select the most appropriate answer. Please provide a final answer to the question.
According to the Big Bang Theory, how is the universe changing?
A. It is contracting.
B. It is expanding.
C. Only the rim is expanding.
D. Only the center is contracting.",B. It is expanding.
"Based on the question, analyze each option and select the most appropriate answer. Please provide a final answer to the question.
Light enters the human eye through the
A. retina.
B. pupil.
C. iris.
D. lens.",B. pupil.
"Based on the question, analyze each option and select the most appropriate answer. Please provide a final answer to the question.
The stages in the life cycle of an organism are shown below. birth -> growth -> development -> reproduction -> death In which life cycle stage will a new organism be made?
A. growth
B. development
C. reproduction
D. death",C. reproduction
"Based on the question, analyze each option and select the most appropriate answer. Please provide a final answer to the question.
Baby chicks peck their way out of their shells when they hatch. This activity is an example of which of the following types of behavior?
A. instinctive
B. learned
C. planned
D. social",A. instinctive
"Based on the question, analyze each option and select the most appropriate answer. Please provide a final answer to the question.
Which conclusion can be made about earthworms because they do not have an internal skeleton?
A. They are invertebrates.
B. They have radial symmetry.
C. They are made of one segment.
D. They have an open circulatory system.",A. They are invertebrates.
"Based on the question, analyze each option and select the most appropriate answer. Please provide a final answer to the question.
The smallest unit of a plant that can perform all of the processes of life is the
A. leaf.
B. cell.
C. tissue.
D. root.",B. cell.
"Based on the question, analyze each option and select the most appropriate answer. Please provide a final answer to the question.
Soda water is a liquid that has bubbles of carbon dioxide in it. Which term best describes soda water?
A. a mixture
B. a molecule
C. an element
D. a compound",A. a mixture
"Based on the question, analyze each option and select the most appropriate answer. Please provide a final answer to the question.
All stars start forming in the same manner. Some follow the life cycle of the Sun, while others turn into neutron stars or black holes. Which property determines the fate of a star as it develops?
A. mass
B. location
C. luminosity
D. temperature",A. mass
"Based on the question, analyze each option and select the most appropriate answer. Please provide a final answer to the question.
If a neutral atom loses an electron, what is formed?
A. A gas
B. An ion
C. An acid
D. A molecule",B. An ion
"Based on the question, analyze each option and select the most appropriate answer. Please provide a final answer to the question.
A student mixed baking soda with vinegar and observed that the reaction was endothermic. When is a reaction endothermic?
A. when it is reversible
B. when it can be repeated
C. when it requires heat to make it happen
D. when energy is released by the process",C. when it requires heat to make it happen
"Based on the question, analyze each option and select the most appropriate answer. Please provide a final answer to the question.
What is the primary energy source that drives all weather events, including precipitation, hurricanes, and tornados?
A. the Sun
B. the Moon
C. Earth's gravity
D. Earth's rotation",A. the Sun
"Based on the question, analyze each option and select the most appropriate answer. Please provide a final answer to the question.
Which system absorbs and carries food from the digestive system to the rest of the body?
A. nervous system
B. muscular system
C. circulatory system
D. respiratory system",C. circulatory system
"Based on the question, analyze each option and select the most appropriate answer. Please provide a final answer to the question.
Why do planets stay in orbit around the Sun?
A. attraction of gravity
B. effect of inertia
C. frictional force
D. rotational force",A. attraction of gravity
"Based on the question, analyze each option and select the most appropriate answer. Please provide a final answer to the question.
Earth rotates on its north-south axis. Which statement best describes one complete rotation?
A. It takes six months and causes summer and winter seasons.
B. It takes 24 hours and causes night and day.
C. It takes 29 days, which represents one cycle of the Moon's phases.
D. It takes 365 days, which represents one Earth year.",B. It takes 24 hours and causes night and day.
"Based on the question, analyze each option and select the most appropriate answer. Please provide a final answer to the question.
A rock sample will most likely contain
A. plants.
B. minerals.
C. water.
D. wood.",B. minerals.
